{
  "format": "nexonova.corporate-site.v0.1.0",
  "project_id": "synthetic-website",
  "locale": "es-CL",
  "route": "/",
  "source_id": "synthetic-brief",
  "brand": {
    "name": "Empresa Sintética",
    "colors": {
      "navy": "#172033",
      "blue": "#234567",
      "cyan": "#267878"
    },
    "font_family": "Inter",
    "font_approval": "pending"
  },
  "sections": [
    {
      "id": "header",
      "title": "Navegación",
      "enabled": true
    },
    {
      "id": "hero",
      "title": "Presentación de Empresa Sintética",
      "enabled": true
    },
    {
      "id": "domains",
      "title": "Consulta de dominios — demostración",
      "enabled": true
    },
    {
      "id": "about",
      "title": "Sobre Empresa Sintética",
      "enabled": true
    },
    {
      "id": "plans",
      "title": "Planes de ejemplo",
      "enabled": true
    },
    {
      "id": "services",
      "title": "Servicios",
      "enabled": true
    },
    {
      "id": "faq",
      "title": "Preguntas frecuentes",
      "enabled": true
    },
    {
      "id": "contact",
      "title": "Preparar consulta — no enviada",
      "enabled": true
    },
    {
      "id": "footer",
      "title": "Información y créditos",
      "enabled": true
    },
    {
      "id": "chat",
      "title": "Asistente de demostración",
      "enabled": true
    },
    {
      "id": "inquiry",
      "title": "Tu consulta",
      "enabled": true
    }
  ],
  "plans": [],
  "services": [
    "Servicio de ejemplo"
  ],
  "behaviors": {
    "domains": "local-format-only",
    "chat": "local-scripted",
    "inquiry": "interest-summary",
    "contact": "prepare-copy-not-sent",
    "persistence": "memory-only",
    "external_requests": "disabled"
  },
  "assets": [],
  "pending_decisions": [
    "Select exact logo/hero/icon assets and substantiate provenance; no shared assets approved by inference.",
    "Decide recover/replace/remove for missing referenced resources.",
    "Approve local Inter distribution and license evidence.",
    "Approve final editorial content; commercial values remain provisional."
  ],
  "acceptance": [
    "Original source hashes unchanged",
    "Only route /; no independent ventas/desarrollo pages",
    "No external business-service requests",
    "Domains never claim availability",
    "Chat is explicitly local demonstration",
    "Inquiry never creates an order or sends a message",
    "Keyboard/mobile/reduced-motion behavior validated",
    "Build/typecheck/tests required before product acceptance",
    "Second synthetic configuration has no NexoNova identity leakage",
    "Independent product without factory runtime or private metadata"
  ]
}
